{
  "artifact_inventory": {
    "first_failures": [],
    "first_inventory_sha256": "8f8328ad6d1d1e995a64905fb651d39b727eca69d436baa8c157dab2237a5cf2",
    "identical": true,
    "second_failures": [],
    "second_inventory_sha256": "8f8328ad6d1d1e995a64905fb651d39b727eca69d436baa8c157dab2237a5cf2"
  },
  "batch_id": "WA-PB01",
  "criteria": {
    "all_generated_artifacts_have_sha256": true,
    "all_nesting_relationships_preserved_as_lists": true,
    "all_output_paths_are_unique": true,
    "all_targets_are_deterministic": true,
    "all_targets_have_one_result_per_run": true,
    "all_targets_resolve_classify_and_generate": true,
    "artifact_inventories_are_identical": true,
    "target_crosswalk_parity": true,
    "zero_target_only_production_patches": true
  },
  "crosswalk_sha256": "e5e9739380738142535040bd643225638f236706a684374c83d1178fc3a96d38",
  "evaluation_id": "cd9fea3aad75dc97e7c4",
  "first_run_id": "7ad97093b4ee98e829e8",
  "manifest_name": "production_batch_wa_100_wa_pb01_a",
  "manifest_sha256": "59c59b3d540f3106cbf131b78c3495d8039100eedda407f202d16e338effcb50",
  "run_asof": "2026-08-03T18:00:00Z",
  "schema_version": 1,
  "second_run_id": "7ad97093b4ee98e829e8",
  "summary": {
    "artifact_count": 42,
    "artifact_inventories_identical": true,
    "deterministic_count": 20,
    "gate_passed": true,
    "nesting_parity_count": 20,
    "passed_count": 20,
    "reports_identical": true,
    "shared_artifact_count": 2,
    "target_artifact_count": 40,
    "target_count": 20,
    "target_only_patch_count": 0,
    "unique_output_paths": true
  },
  "targets": [
    {
      "census_geoid": "5333560",
      "deterministic": true,
      "division_paths": [
        "divisions/wa/local/ione_5333560_b7ea43f4-0d46-50e6-af61-7f9c4ce4f8c6.yaml"
      ],
      "exception_class": null,
      "failures": [],
      "generation_status": "generated",
      "inferred_classification": "government",
      "jurisdiction_name": "Ione",
      "jurisdiction_paths": [
        "jurisdictions/wa/local/ione_d213606b-876e-5103-b50b-ba80b690c0e1.yaml"
      ],
      "maintained_ocdid": "ocd-division/country:us/state:wa/place:ione",
      "nesting_parity": true,
      "output_hashes": {
        "divisions/wa/local/ione_5333560_b7ea43f4-0d46-50e6-af61-7f9c4ce4f8c6.yaml": "cb32c645753f82007a84380e8a782833c1699c3eaaae309901148d2ddb69917e",
        "jurisdictions/wa/local/ione_d213606b-876e-5103-b50b-ba80b690c0e1.yaml": "4a0b123280e2ba3bc26e7c6279aac0d51ed77f233c8ab1674a52c77da46cab02"
      },
      "resolved_ocdids": [
        "ocd-division/country:us/state:wa/place:ione"
      ],
      "review_reason": null,
      "status": "passed",
      "target_id": "WA-PB01-001",
      "wave": "WA-PB01-A"
    },
    {
      "census_geoid": "5333805",
      "deterministic": true,
      "division_paths": [
        "divisions/wa/local/issaquah_5333805_2fdce080-6dd6-50d0-ba2c-425f4bebea57.yaml"
      ],
      "exception_class": null,
      "failures": [],
      "generation_status": "generated",
      "inferred_classification": "government",
      "jurisdiction_name": "Issaquah",
      "jurisdiction_paths": [
        "jurisdictions/wa/local/issaquah_e9236fae-70d7-56c5-86b1-05b3742b5149.yaml"
      ],
      "maintained_ocdid": "ocd-division/country:us/state:wa/place:issaquah",
      "nesting_parity": true,
      "output_hashes": {
        "divisions/wa/local/issaquah_5333805_2fdce080-6dd6-50d0-ba2c-425f4bebea57.yaml": "7dad4cdd6c46a5384e844dd5ad321a9fdae2dedf2624853a759f28c0aab2a71d",
        "jurisdictions/wa/local/issaquah_e9236fae-70d7-56c5-86b1-05b3742b5149.yaml": "c7e1aecc4bbde4e40bfc5da8fa43592f0cfd0231d45073522d3aecb9493dd78e"
      },
      "resolved_ocdids": [
        "ocd-division/country:us/state:wa/place:issaquah"
      ],
      "review_reason": null,
      "status": "passed",
      "target_id": "WA-PB01-002",
      "wave": "WA-PB01-A"
    },
    {
      "census_geoid": "5334575",
      "deterministic": true,
      "division_paths": [
        "divisions/wa/local/kahlotus_5334575_014ec053-23fb-5c92-b130-e45a4dfdaa25.yaml"
      ],
      "exception_class": null,
      "failures": [],
      "generation_status": "generated",
      "inferred_classification": "government",
      "jurisdiction_name": "Kahlotus",
      "jurisdiction_paths": [
        "jurisdictions/wa/local/kahlotus_83d7d4c8-a1f5-5b44-8efa-631fed0ce8a6.yaml"
      ],
      "maintained_ocdid": "ocd-division/country:us/state:wa/place:kahlotus",
      "nesting_parity": true,
      "output_hashes": {
        "divisions/wa/local/kahlotus_5334575_014ec053-23fb-5c92-b130-e45a4dfdaa25.yaml": "714b7d00c0ad5a41d3bb4c2e5e1d1bddad360e2fc8e3d89d6dc053cdc9df77e2",
        "jurisdictions/wa/local/kahlotus_83d7d4c8-a1f5-5b44-8efa-631fed0ce8a6.yaml": "7043c52ca713b00c85382e48d837ac4d14412c46fff2f4907604949b727053f5"
      },
      "resolved_ocdids": [
        "ocd-division/country:us/state:wa/place:kahlotus"
      ],
      "review_reason": null,
      "status": "passed",
      "target_id": "WA-PB01-003",
      "wave": "WA-PB01-A"
    },
    {
      "census_geoid": "5334645",
      "deterministic": true,
      "division_paths": [
        "divisions/wa/local/kalama_5334645_59fcf150-bbbc-53ba-9492-d7f3cb7300be.yaml"
      ],
      "exception_class": null,
      "failures": [],
      "generation_status": "generated",
      "inferred_classification": "government",
      "jurisdiction_name": "Kalama",
      "jurisdiction_paths": [
        "jurisdictions/wa/local/kalama_6da652af-8482-59e3-91ba-198eca80bd99.yaml"
      ],
      "maintained_ocdid": "ocd-division/country:us/state:wa/place:kalama",
      "nesting_parity": true,
      "output_hashes": {
        "divisions/wa/local/kalama_5334645_59fcf150-bbbc-53ba-9492-d7f3cb7300be.yaml": "ff2d6fe864400b9a9e042c7da0f066d97e9ce35bb9618a2a232831a925dcda95",
        "jurisdictions/wa/local/kalama_6da652af-8482-59e3-91ba-198eca80bd99.yaml": "5af698411b11cbb545bd2f65558a40da143a23df8d0884ae372013ce5fd55a0c"
      },
      "resolved_ocdids": [
        "ocd-division/country:us/state:wa/place:kalama"
      ],
      "review_reason": null,
      "status": "passed",
      "target_id": "WA-PB01-004",
      "wave": "WA-PB01-A"
    },
    {
      "census_geoid": "5335065",
      "deterministic": true,
      "division_paths": [
        "divisions/wa/local/kelso_5335065_cd2c7050-5d9a-5504-8504-201f37223f53.yaml"
      ],
      "exception_class": null,
      "failures": [],
      "generation_status": "generated",
      "inferred_classification": "government",
      "jurisdiction_name": "Kelso",
      "jurisdiction_paths": [
        "jurisdictions/wa/local/kelso_fb963aba-8647-5ac6-88b2-27bf46ed01a7.yaml"
      ],
      "maintained_ocdid": "ocd-division/country:us/state:wa/place:kelso",
      "nesting_parity": true,
      "output_hashes": {
        "divisions/wa/local/kelso_5335065_cd2c7050-5d9a-5504-8504-201f37223f53.yaml": "7c32ab564d0d27099f5aafab4912eaaad053016647ebfa2146f7a83afecebafd",
        "jurisdictions/wa/local/kelso_fb963aba-8647-5ac6-88b2-27bf46ed01a7.yaml": "12c4998554b7507827b0688373b5a736f43be964d85890d459345dfe8a95d307"
      },
      "resolved_ocdids": [
        "ocd-division/country:us/state:wa/place:kelso"
      ],
      "review_reason": null,
      "status": "passed",
      "target_id": "WA-PB01-005",
      "wave": "WA-PB01-A"
    },
    {
      "census_geoid": "5335170",
      "deterministic": true,
      "division_paths": [
        "divisions/wa/local/kenmore_5335170_976ea52b-81b5-5588-a802-ef3c2a63c82c.yaml"
      ],
      "exception_class": null,
      "failures": [],
      "generation_status": "generated",
      "inferred_classification": "government",
      "jurisdiction_name": "Kenmore",
      "jurisdiction_paths": [
        "jurisdictions/wa/local/kenmore_3dc8713c-5a71-5f66-b55b-18cffd758e0c.yaml"
      ],
      "maintained_ocdid": "ocd-division/country:us/state:wa/place:kenmore",
      "nesting_parity": true,
      "output_hashes": {
        "divisions/wa/local/kenmore_5335170_976ea52b-81b5-5588-a802-ef3c2a63c82c.yaml": "459e166d88328677b2503f58e0954e13ff06544c4a66f10326b308bb75a68f21",
        "jurisdictions/wa/local/kenmore_3dc8713c-5a71-5f66-b55b-18cffd758e0c.yaml": "5542c04ee7fc1330f98e34e1d13c7461f33f78e05579d1067880fd64ddf90f92"
      },
      "resolved_ocdids": [
        "ocd-division/country:us/state:wa/place:kenmore"
      ],
      "review_reason": null,
      "status": "passed",
      "target_id": "WA-PB01-006",
      "wave": "WA-PB01-A"
    },
    {
      "census_geoid": "5335275",
      "deterministic": true,
      "division_paths": [
        "divisions/wa/local/kennewick_5335275_d0e3b13f-8284-5bef-8d1a-61aac67d7167.yaml"
      ],
      "exception_class": null,
      "failures": [],
      "generation_status": "generated",
      "inferred_classification": "government",
      "jurisdiction_name": "Kennewick",
      "jurisdiction_paths": [
        "jurisdictions/wa/local/kennewick_5cf51f8c-db3f-5bdc-9476-d53b18cf04f4.yaml"
      ],
      "maintained_ocdid": "ocd-division/country:us/state:wa/place:kennewick",
      "nesting_parity": true,
      "output_hashes": {
        "divisions/wa/local/kennewick_5335275_d0e3b13f-8284-5bef-8d1a-61aac67d7167.yaml": "190ba5ca4b90428d2d86ea2b01247a4d16f4c5b8ac8cb518a5b93eceb805dd03",
        "jurisdictions/wa/local/kennewick_5cf51f8c-db3f-5bdc-9476-d53b18cf04f4.yaml": "de52917b7833062c46772170d54f9defad4e00eb11854b3165f9915c9903ae71"
      },
      "resolved_ocdids": [
        "ocd-division/country:us/state:wa/place:kennewick"
      ],
      "review_reason": null,
      "status": "passed",
      "target_id": "WA-PB01-007",
      "wave": "WA-PB01-A"
    },
    {
      "census_geoid": "5335485",
      "deterministic": true,
      "division_paths": [
        "divisions/wa/local/kettle_falls_5335485_486c2d8f-0db4-5a2d-918e-ecdb8290b365.yaml"
      ],
      "exception_class": null,
      "failures": [],
      "generation_status": "generated",
      "inferred_classification": "government",